{
  "schema_version": 1,
  "name": "Demo set",
  "target": "axoloti",
  "entries": [
    {"name": "first-synth", "patch": "../patches/first-synth.json"},
    {"name": "plucked-string", "patch": "../patches/plucked-string.json"},
    {"name": "acid-bass", "patch": "../patches/synths/acid-bass.json"},
    {"name": "mallard", "patch": "../patches/synths/mallard.json"},
    {"name": "coin", "patch": "demo/coin.json"},
    {"name": "jump", "patch": "demo/jump.json"},
    {"name": "powerup", "patch": "demo/powerup.json"},
    {"name": "hurt", "patch": "demo/hurt.json"},
    {"name": "explode", "patch": "demo/explode.json"},
    {"name": "yes-dear", "patch": "../patches/yes-dear.json"}
  ]
}
